{
  "aggregate": {
    "case_count": 5,
    "collision_count": 0,
    "failed_case_count": 0,
    "minimum_clearance_m": 0.883147,
    "passed_case_count": 4,
    "physical_skill_episode_count": 6,
    "simulator_step_count": 1137,
    "simulator_steps_per_case": {
      "count": 5,
      "maximum": 389.0,
      "mean": 227.4,
      "median": 227.0,
      "minimum": 64.0
    },
    "supported_case_count": 4,
    "supported_case_success_rate": 1.0,
    "timeout_count": 0,
    "unsupported_case_count": 1
  },
  "cases": [
    {
      "case_id": "sidewalk_then_hold",
      "executive": {
        "checkpoint_correction": null,
        "events": [
          {
            "accepted": true,
            "disposition": "queued",
            "event": "submit",
            "plan_revision": 1,
            "reason": "validated task queued",
            "task_id": "parcel-task-2b2be1ca3cc652a391904083"
          },
          {
            "attempt": 1,
            "event": "dispatch",
            "skill": "NavigateTo",
            "step_id": "step_1"
          },
          {
            "detail_code": "navigation_goal_verified",
            "event": "result",
            "feedback_code": "succeeded",
            "report_action": "step_succeeded",
            "result_status": "succeeded",
            "skill": "NavigateTo",
            "step_id": "step_1"
          },
          {
            "attempt": 1,
            "event": "dispatch",
            "skill": "Hold",
            "step_id": "step_2"
          },
          {
            "detail_code": "motion_stop_verified",
            "event": "result",
            "feedback_code": "succeeded",
            "report_action": "task_succeeded",
            "result_status": "succeeded",
            "skill": "Hold",
            "step_id": "step_2"
          }
        ],
        "final_task": {
          "at_checkpoint": true,
          "attempt": 1,
          "last_detail": "motion_stop_verified",
          "pending_recovery": null,
          "pending_replacement_revision": null,
          "plan_revision": 1,
          "plan_sha256": "b3ef4019a9cdb989383307f24cf17cf5df5491f381569f8c5af0f2a125bd1fd4",
          "resource_conflicts": [],
          "state": "succeeded",
          "step_id": null,
          "step_index": 2,
          "task_class": "active_task",
          "task_id": "parcel-task-2b2be1ca3cc652a391904083"
        },
        "submission": {
          "accepted": true,
          "disposition": "queued",
          "event": "submit",
          "plan_revision": 1,
          "reason": "validated task queued",
          "task_id": "parcel-task-2b2be1ca3cc652a391904083"
        }
      },
      "physical": {
        "backend": "headless_mujoco_city",
        "base_motion": "deterministic_kinematic_mujoco_geometry",
        "collision_count": 0,
        "evaluator_truth_available_to_policy": false,
        "executions": [
          {
            "collision_count": 0,
            "controller_reason": "arrived_verified",
            "controller_status": "arrived",
            "minimum_clearance_m": 1.115895,
            "required_clearance_m": 0.65,
            "simulator_step_count": 227,
            "skill": "NavigateTo",
            "supported": true,
            "target": "sidewalk",
            "terminal_stopped": true,
            "timed_out": false,
            "unsupported_reason": null
          },
          {
            "collision_count": 0,
            "controller_reason": null,
            "controller_status": null,
            "minimum_clearance_m": null,
            "required_clearance_m": null,
            "simulator_step_count": 0,
            "skill": "Hold",
            "supported": true,
            "target": null,
            "terminal_stopped": true,
            "timed_out": false,
            "unsupported_reason": null
          }
        ],
        "final_pose": {
          "x": 1.580468,
          "y": 2.541718,
          "yaw_rad": 2.694439
        },
        "initial_pose": {
          "x": 0.0,
          "y": 0.0,
          "yaw_rad": 0.0
        },
        "minimum_clearance_m": 1.115895,
        "physical_skill_episode_count": 1,
        "policy_observation_contract": [
          "camera",
          "lidar",
          "owner_track",
          "odometry"
        ],
        "simulator_step_count": 227,
        "terminal_stopped": true,
        "timeout_count": 0
      },
      "plan": {
        "plan_revision": 1,
        "skills": [
          "NavigateTo",
          "Hold"
        ],
        "source_turn_id": "planner-v2-sidewalk_then_hold",
        "task_id": "parcel-task-2b2be1ca3cc652a391904083",
        "validated_against_snapshot_id": "embodied-admission-sidewalk_then_hold",
        "validated_plan_sha256": "b3ef4019a9cdb989383307f24cf17cf5df5491f381569f8c5af0f2a125bd1fd4"
      },
      "reason": "executive_and_evaluator_semantics_satisfied",
      "seed": 41001,
      "semantic": {
        "checks": {
          "clearance_respected": true,
          "collision_free": true,
          "controller_arrived": true,
          "final_stop_confirmed": true,
          "inside": true,
          "no_timeout": true,
          "off_road": true,
          "simulator_steps_executed": true,
          "terminal_stopped": true
        },
        "evaluator": "sidewalk_inside_off_road",
        "metrics": {
          "final_xy": [
            1.580468,
            2.541718
          ],
          "region_id": "sidewalk",
          "required_interior_clearance_m": 0.32
        },
        "passed": true
      },
      "status": "passed",
      "support": {
        "status": "supported",
        "supported_physical_skills": [
          "Hold",
          "MoveRelative",
          "NavigateTo",
          "OrbitOwner"
        ],
        "unsupported_skills": []
      }
    },
    {
      "case_id": "sidewalk_then_lamppost",
      "executive": {
        "checkpoint_correction": null,
        "events": [
          {
            "accepted": true,
            "disposition": "queued",
            "event": "submit",
            "plan_revision": 1,
            "reason": "validated task queued",
            "task_id": "parcel-task-a7044ea956a51a694c7d4388"
          },
          {
            "attempt": 1,
            "event": "dispatch",
            "skill": "NavigateTo",
            "step_id": "step_1"
          },
          {
            "detail_code": "navigation_goal_verified",
            "event": "result",
            "feedback_code": "succeeded",
            "report_action": "step_succeeded",
            "result_status": "succeeded",
            "skill": "NavigateTo",
            "step_id": "step_1"
          },
          {
            "attempt": 1,
            "event": "dispatch",
            "skill": "NavigateTo",
            "step_id": "step_2"
          },
          {
            "detail_code": "navigation_goal_verified",
            "event": "result",
            "feedback_code": "succeeded",
            "report_action": "step_succeeded",
            "result_status": "succeeded",
            "skill": "NavigateTo",
            "step_id": "step_2"
          },
          {
            "attempt": 1,
            "event": "dispatch",
            "skill": "Hold",
            "step_id": "step_3"
          },
          {
            "detail_code": "motion_stop_verified",
            "event": "result",
            "feedback_code": "succeeded",
            "report_action": "task_succeeded",
            "result_status": "succeeded",
            "skill": "Hold",
            "step_id": "step_3"
          }
        ],
        "final_task": {
          "at_checkpoint": true,
          "attempt": 1,
          "last_detail": "motion_stop_verified",
          "pending_recovery": null,
          "pending_replacement_revision": null,
          "plan_revision": 1,
          "plan_sha256": "ed20dd7cf45e9b68998b4cf1c506d46bbb3956656dabfae1fb59ac3d5f40586a",
          "resource_conflicts": [],
          "state": "succeeded",
          "step_id": null,
          "step_index": 3,
          "task_class": "active_task",
          "task_id": "parcel-task-a7044ea956a51a694c7d4388"
        },
        "submission": {
          "accepted": true,
          "disposition": "queued",
          "event": "submit",
          "plan_revision": 1,
          "reason": "validated task queued",
          "task_id": "parcel-task-a7044ea956a51a694c7d4388"
        }
      },
      "physical": {
        "backend": "headless_mujoco_city",
        "base_motion": "deterministic_kinematic_mujoco_geometry",
        "collision_count": 0,
        "evaluator_truth_available_to_policy": false,
        "executions": [
          {
            "collision_count": 0,
            "controller_reason": "arrived_verified",
            "controller_status": "arrived",
            "minimum_clearance_m": 1.115895,
            "required_clearance_m": 0.65,
            "simulator_step_count": 227,
            "skill": "NavigateTo",
            "supported": true,
            "target": "sidewalk",
            "terminal_stopped": true,
            "timed_out": false,
            "unsupported_reason": null
          },
          {
            "collision_count": 0,
            "controller_reason": "arrived_verified",
            "controller_status": "arrived",
            "minimum_clearance_m": 0.998978,
            "required_clearance_m": 0.65,
            "simulator_step_count": 36,
            "skill": "NavigateTo",
            "supported": true,
            "target": "lamppost",
            "terminal_stopped": true,
            "timed_out": false,
            "unsupported_reason": null
          },
          {
            "collision_count": 0,
            "controller_reason": null,
            "controller_status": null,
            "minimum_clearance_m": null,
            "required_clearance_m": null,
            "simulator_step_count": 0,
            "skill": "Hold",
            "supported": true,
            "target": null,